{
  "version": 1,
  "layout_version": 1,
  "timezone": "Asia/Kolkata",
  "models": {
    "llm": "maxwell1500/ornith-35b:Q4_K_M",
    "embed": "nomic-embed-text",
    "vision": "llama3.2-vision:11b"
  },
  "ollama": {
    "base_url": "http://localhost:11434",
    "num_ctx": 32768,
    "temperature": null
  }
}
